{
  "schema_version": "3.0.0-alpha.1",
  "project": "HAI ĐẤT — 20 BẢN TỔ ĐỜN CA TÀI TỬ NAM BỘ",
  "started_on": "2026-10-28",
  "origin_branch": "v2-development",
  "catalog_status": "research_preview",
  "rights_notice": "Dẫn nguồn không đồng nghĩa được quyền tái bản ký âm, lời ca, bản thu hoặc dùng huấn luyện AI.",
  "verification_notice": "Chỉ là metadata dựa trên hồ sơ V2. 20/20 biên bản đã mở, 0/20 bài nghiệm thu diễn xướng. Các số câu và nhịp thuộc những hệ bản cụ thể, không phải một bản chuẩn duy nhất.",
  "variant_status_definitions": {
    "source_indexed": "Số câu/hệ đã được định vị trong tài liệu ở hồ sơ V2; chưa chứng minh diễn xướng.",
    "source_reported": "Nguồn được hồ sơ V2 thuật lại; cần đối chứng trực tiếp hoặc âm thanh.",
    "derived_unverified": "Bản ánh xạ/biến đổi đang đề xuất; chưa được kiểm chứng độc lập."
  },
  "items": [
    {
      "id": 1,
      "slug": "01-luu-thuy-truong",
      "title": "Lưu Thủy Trường",
      "family": "sau-bac",
      "family_label": "Sáu Bắc",
      "aliases": [
        "Lưu Thủy"
      ],
      "review_status": "source_review_open",
      "performance_status": "pending",
      "rights_status": "unverified",
      "readme_document": "ban-to/01-luu-thuy-truong/README.md",
      "review_document": "ban-to/01-luu-thuy-truong/v2-bien-ban-nghiem-thu.md",
      "variants": [
        {
          "variant_id": "LT-32-4",
          "label": "32 câu nhịp tư (nguồn Văn Dần)",
          "phrase_count": 32,
          "beats_per_phrase": 4,
          "evidence_status": "source_indexed",
          "reference_url": "https://nhacsivandan.wordpress.com/2013/08/18/bai-luu-thuy-truong/",
          "qualification": "Đã rà nhãn 1–32; tài liệu Viện có mô tả 32 câu nhịp tám, cần giữ riêng."
        },
        {
          "variant_id": "LT-16-8",
          "label": "16 câu nhịp tám (quan điểm Nguyễn Vĩnh Bảo)",
          "phrase_count": 16,
          "beats_per_phrase": 8,
          "evidence_status": "source_reported",
          "reference_url": "https://dantranhpvv.wordpress.com/2009/12/20/l%C6%B0u-th%E1%BB%A7y-tr%C6%B0%E1%BB%9Dng/",
          "qualification": "Bản tường thuật riêng; chưa đối chiếu ghi âm và bản sách gốc."
        },
        {
          "variant_id": "LT-32-8",
          "label": "32 câu nhịp tám (mô tả ICHCAP)",
          "phrase_count": 32,
          "beats_per_phrase": 8,
          "evidence_status": "source_reported",
          "reference_url": "https://archive.unesco-ichcap.org/eng/ek/sub16/pdf_file/handbook_cd8.pdf",
          "qualification": "Hệ đếm nhịp bất đồng với Văn Dần; chưa thể coi cùng một bản."
        }
      ],
      "research_note": "Các nguồn không đồng nhất cách đếm 16/32 và nhịp tư/nhịp tám."
    },
    {
      "id": 2,
      "slug": "02-phu-luc-chan",
      "title": "Phú Lục Chấn",
      "family": "sau-bac",
      "family_label": "Sáu Bắc",
      "aliases": [],
      "review_status": "source_review_open",
      "performance_status": "pending",
      "rights_status": "unverified",
      "readme_document": "ban-to/02-phu-luc-chan/README.md",
      "review_document": "ban-to/02-phu-luc-chan/v2-bien-ban-nghiem-thu.md",
      "variants": [
        {
          "variant_id": "PLC-34-4",
          "label": "34 câu nhịp tư",
          "phrase_count": 34,
          "beats_per_phrase": 4,
          "evidence_status": "source_indexed",
          "reference_url": "https://www.namkyluctinh.org/eBooks/AmNhac/Nhac%20Tai%20Tu%20Nam%20Bo%202%20-%20Nhi%20Tan.pdf",
          "qualification": "Nhạc đủ 34 nhãn; lời tr.127/129 chỉ 32 nhãn trong bản Nhị Tấn; nguồn khác đủ 34."
        }
      ],
      "research_note": "Chênh lệch 34 nhãn nhạc và 32 nhãn lời giữa các nguồn."
    },
    {
      "id": 3,
      "slug": "03-binh-ban-chan",
      "title": "Bình Bán Chấn",
      "family": "sau-bac",
      "family_label": "Sáu Bắc",
      "aliases": [],
      "review_status": "source_review_open",
      "performance_status": "pending",
      "rights_status": "unverified",
      "readme_document": "ban-to/03-binh-ban-chan/README.md",
      "review_document": "ban-to/03-binh-ban-chan/v2-bien-ban-nghiem-thu.md",
      "variants": [
        {
          "variant_id": "BBC-44-4",
          "label": "44 câu nhịp tư",
          "phrase_count": 44,
          "beats_per_phrase": 4,
          "evidence_status": "source_indexed",
          "reference_url": "https://www.namkyluctinh.org/eBooks/AmNhac/Nhac%20Tai%20Tu%20Nam%20Bo%202%20-%20Nhi%20Tan.pdf",
          "qualification": "Có 44 nhãn nhạc/lời ở trang in 130–135; chưa kiểm thực tấu."
        },
        {
          "variant_id": "BBC-22-8",
          "label": "22 câu nhịp tám (thuyết minh Viện)",
          "phrase_count": 22,
          "beats_per_phrase": 8,
          "evidence_status": "source_reported",
          "reference_url": "https://vienamnhac.vn/Media/Default/Download/20%20ban%20to%20ch.pdf",
          "qualification": "Mô tả hệ đếm khác, chưa đối chiếu bản ghi 22 câu."
        }
      ],
      "research_note": "Phân biệt bản 44 câu nhịp tư và hệ 22 câu nhịp tám."
    },
    {
      "id": 4,
      "slug": "04-co-ban-van",
      "title": "Cổ Bản",
      "family": "sau-bac",
      "family_label": "Sáu Bắc",
      "aliases": [
        "Cổ Bản Vắn",
        "Cổ Bản Trường"
      ],
      "review_status": "source_review_open",
      "performance_status": "pending",
      "rights_status": "unverified",
      "readme_document": "ban-to/04-co-ban-van/README.md",
      "review_document": "ban-to/04-co-ban-van/v2-bien-ban-nghiem-thu.md",
      "variants": [
        {
          "variant_id": "CBV-34-4",
          "label": "Cổ Bản Vắn",
          "phrase_count": 34,
          "beats_per_phrase": 4,
          "evidence_status": "source_indexed",
          "reference_url": "https://www.namkyluctinh.org/eBooks/AmNhac/Nhac%20Tai%20Tu%20Nam%20Bo%202%20-%20Nhi%20Tan.pdf",
          "qualification": "34 câu bản Vắn; không đại diện bản Trường."
        },
        {
          "variant_id": "CBT-68-4",
          "label": "Cổ Bản Trường",
          "phrase_count": 68,
          "beats_per_phrase": 4,
          "evidence_status": "source_indexed",
          "reference_url": "https://www.namkyluctinh.org/eBooks/AmNhac/Nhac%20Tai%20Tu%20Nam%20Bo%202%20-%20Nhi%20Tan.pdf",
          "qualification": "68 câu bản Trường, có bảng nhạc/lời; cần nghiệm thu riêng."
        }
      ],
      "research_note": "Hai hệ Vắn/Trường độc lập; không cộng thành 102 câu."
    },
    {
      "id": 5,
      "slug": "05-xuan-tinh-chan",
      "title": "Xuân Tình Chấn",
      "family": "sau-bac",
      "family_label": "Sáu Bắc",
      "aliases": [],
      "review_status": "source_review_open",
      "performance_status": "pending",
      "rights_status": "unverified",
      "readme_document": "ban-to/05-xuan-tinh-chan/README.md",
      "review_document": "ban-to/05-xuan-tinh-chan/v2-bien-ban-nghiem-thu.md",
      "variants": [
        {
          "variant_id": "XTC-48-4",
          "label": "48 câu nhịp tư",
          "phrase_count": 48,
          "beats_per_phrase": 4,
          "evidence_status": "source_indexed",
          "reference_url": "https://www.namkyluctinh.org/eBooks/AmNhac/Nhac%20Tai%20Tu%20Nam%20Bo%202%20-%20Nhi%20Tan.pdf",
          "qualification": "Bản nhạc/lời đủ 48 nhãn; có bản Thủ khác, chưa thẩm âm."
        }
      ],
      "research_note": "Bản Thủ và bản tập II có nét nhạc và bộ lời khác nhau."
    },
    {
      "id": 6,
      "slug": "06-tay-thi-van",
      "title": "Tây Thi",
      "family": "sau-bac",
      "family_label": "Sáu Bắc",
      "aliases": [
        "Tây Thi Vắn",
        "Tây Thi Trường"
      ],
      "review_status": "source_review_open",
      "performance_status": "pending",
      "rights_status": "unverified",
      "readme_document": "ban-to/06-tay-thi-van/README.md",
      "review_document": "ban-to/06-tay-thi-van/v2-bien-ban-nghiem-thu.md",
      "variants": [
        {
          "variant_id": "TSV-26-4",
          "label": "Tây Thi Vắn",
          "phrase_count": 26,
          "beats_per_phrase": 4,
          "evidence_status": "source_indexed",
          "reference_url": "https://www.namkyluctinh.org/eBooks/AmNhac/Nhac%20Tai%20Tu%20Nam%20Bo%202%20-%20Nhi%20Tan.pdf",
          "qualification": "26 nhãn chính; tiêu đề '34 câu' ở nguồn web không khớp phần đánh số."
        },
        {
          "variant_id": "TST-52-4",
          "label": "Tây Thi Trường",
          "phrase_count": 52,
          "beats_per_phrase": 4,
          "evidence_status": "source_indexed",
          "reference_url": "https://www.namkyluctinh.org/eBooks/AmNhac/Nhac%20Tai%20Tu%20Nam%20Bo%202%20-%20Nhi%20Tan.pdf",
          "qualification": "52 câu bản Trường; không được gộp với 26 câu Vắn."
        }
      ],
      "research_note": "Không lập một dị bản 34 câu khi chỉ có tiêu đề thiếu nhãn đối chứng."
    },
    {
      "id": 7,
      "slug": "07-xang-xe",
      "title": "Xàng Xê",
      "family": "bay-le",
      "family_label": "Bảy Lễ",
      "aliases": [
        "Xàng Xề"
      ],
      "review_status": "source_review_open",
      "performance_status": "pending",
      "rights_status": "unverified",
      "readme_document": "ban-to/07-xang-xe/README.md",
      "review_document": "ban-to/07-xang-xe/v2-bien-ban-nghiem-thu.md",
      "variants": [
        {
          "variant_id": "XX-64-4",
          "label": "64 câu nhịp tư",
          "phrase_count": 64,
          "beats_per_phrase": 4,
          "evidence_status": "source_indexed",
          "reference_url": "https://conhacnambo.com/destop/topics_list.php?topic_id=424",
          "qualification": "Bản trực tuyến có đủ 64 nhãn; lớp III có Xê/Xề khác nguồn."
        }
      ],
      "research_note": "Còn khác biệt Xê/Xề và cách diễn giải nhịp."
    },
    {
      "id": 8,
      "slug": "08-ngu-doi-thuong",
      "title": "Ngũ Đối Thượng",
      "family": "bay-le",
      "family_label": "Bảy Lễ",
      "aliases": [],
      "review_status": "source_review_open",